{
  "schema": "company-os.release-scope-design-decision.v1",
  "record_version": 1,
  "decision": "accepted",
  "authority_role": "master",
  "decider_task_id": "example-master-1",
  "bindings": {
    "project_id": "example-project",
    "program_id": "example-program",
    "program_version": 1,
    "definition_version": 1,
    "cycle_id": "example-cycle-1",
    "outcome_digest": "0000000000000000000000000000000000000000000000000000000000000000",
    "scope_definition_sha256": "0000000000000000000000000000000000000000000000000000000000000000"
  },
  "authentication": {
    "scheme": "company-os.fixture-hmac-sha256.v1",
    "key_id": "company-os-repository-test-v1",
    "signature": "0000000000000000000000000000000000000000000000000000000000000000"
  }
}
